8.5A|UNIFORM COMMERCIAL CODE — LETTERS OF CREDIT|||||||||||§ 8.5A-101|Short title.|<p>This title may be cited as Uniform Commercial Code--Letters of Credit (1995).</p><p>1997, c. <a href='http://lis.virginia.gov/cgi-bin/legp604.exe?971+ful+CHAP0343'>343</a>.</p>
8.5A|UNIFORM COMMERCIAL CODE — LETTERS OF CREDIT|||||||||||§ 8.5A-115|Statute of limitations.|<p>An action to enforce a right or obligation arising under this title must be commenced within one year after the expiration date of the relevant letter of credit or one year after the cause of action accrues, whichever occurs later. A cause of action accrues when the breach occurs, regardless of the aggrieved party's lack of knowledge of the breach.</p><p>1997, c. <a href='http://lis.virginia.gov/cgi-bin/legp604.exe?971+ful+CHAP0343'>343</a>.</p>
8.5A|UNIFORM COMMERCIAL CODE — LETTERS OF CREDIT|||||||||||§ 8.5A-116|Choice of law and forum.|<p>(a) The liability of an issuer, nominated person, or adviser for action or omission is governed by the law of the jurisdiction chosen by an agreement in the form of a record signed or otherwise authenticated by the affected parties in the manner provided in § <a href='http://law.lis.virginia.gov/vacode/8.5A-104/'>8.5A-104</a> or by a provision in the person's letter of credit, confirmation, or other undertaking. The jurisdiction whose law is chosen need not bear any relation to the transaction.</p><p>(b) Unless subsection (a) applies, the liability of an issuer, nominated person, or adviser for action or omission is governed by the law of the jurisdiction in which the person is located. The person is considered to be located at the address indicated in the person's undertaking. If more than one address is indicated, the person is considered to be located at the address from which the person's undertaking was issued. For the purpose of jurisdiction, choice of law, and recognition of interbranch letters of credit, but not enforcement of a judgment, all branches of a bank are considered separate juridical entities and a bank is considered to be located at the place where its relevant branch is considered to be located under this subsection.</p><p>(c) Except as otherwise provided in this subsection, the liability of an issuer, nominated person, or adviser is governed by any rules of custom or practice, such as the Uniform Customs and Practice for Documentary Credits, to which the letter of credit, confirmation, or other undertaking is expressly made subject. If (i) this title would govern the liability of an issuer, nominated person, or adviser under subsection (a) or (b), (ii) the relevant undertaking incorporates rules of custom or practice, and (iii) there is conflict between this title and those rules as applied to that undertaking, those rules govern except to the extent of any conflict with the nonvariable provisions specified in § <a href='http://law.lis.virginia.gov/vacode/8.5A-103/'>8.5A-103</a>(c).</p><p>(d) If there is conflict between this title and Titles 8.3A, 8.4, 8.4A, or 8.9A, this title governs.</p><p>(e) The forum for settling disputes arising out of an undertaking within this title may be chosen in the manner and with the binding effect that governing law may be chosen in accordance with subsection (a).</p><p>1997, c. <a href='http://lis.virginia.gov/cgi-bin/legp604.exe?971+ful+CHAP0343'>343</a>.</p>
8.5A|UNIFORM COMMERCIAL CODE — LETTERS OF CREDIT|||||||||||§ 8.5A-117|Subrogation of issuer, applicant, and nominated person.|<p>(a) An issuer that honors a beneficiary's presentation is subrogated to the rights of the beneficiary to the same extent as if the issuer were a secondary obligor of the underlying obligation owed to the beneficiary and of the applicant to the same extent as if the issuer were the secondary obligor of the underlying obligation owed to the applicant.</p><p>(b) An applicant that reimburses an issuer is subrogated to the rights of the issuer against any beneficiary, presenter, or nominated person to the same extent as if the applicant were the secondary obligor of the obligations owed to the issuer and has the rights of subrogation of the issuer to the rights of the beneficiary stated in subsection (a).</p><p>(c) A nominated person who pays or gives value against a draft or demand presented under a letter of credit is subrogated to the rights of:</p><p>(1) the issuer against the applicant to the same extent as if the nominated person were a secondary obligor of the obligation owed to the issuer by the applicant;</p><p>(2) the beneficiary to the same extent as if the nominated person were a secondary obligor of the underlying obligation owed to the beneficiary; and</p><p>(3) the applicant to same extent as if the nominated person were a secondary obligor of the underlying obligation owed to the applicant.</p><p>(d) Notwithstanding any agreement or term to the contrary, the rights of subrogation stated in subsections (a) and (b) do not arise until the issuer honors the letter of credit or otherwise pays, and the rights in subsection (c) do not arise until the nominated person pays or otherwise gives value. Until then, the issuer, nominated person, and the applicant do not derive under this section present or prospective rights forming the basis of a claim, defense, or excuse.</p><p>1997, c. <a href='http://lis.virginia.gov/cgi-bin/legp604.exe?971+ful+CHAP0343'>343</a>.</p>
8.5A|UNIFORM COMMERCIAL CODE — LETTERS OF CREDIT|||||||||||§ 8.5A-117.1|Security interest of issuer or nominated person.|<p>(a) An issuer or nominated person has a security interest in a document presented under a letter of credit to the extent that the issuer or nominated person honors or gives value for the presentation.</p><p>(b) So long as and to the extent that an issuer or nominated person has not been reimbursed or has not otherwise recovered the value given with respect to a security interest in a document under subsection (a), the security interest continues and is subject to Title 8.9A, but:</p><p>(1) a security agreement is not necessary to make the security interest enforceable under subdivision (b) (3) of § <a href='http://law.lis.virginia.gov/vacode/8.9A-203/'>8.9A-203</a>;</p><p>(2) if the document is presented in a medium other than a written or other tangible medium, the security interest is perfected; and</p><p>(3) if the document is presented in a written or other tangible medium and is not a certificated security, chattel paper, a document of title, an instrument, or a letter of credit, the security interest is perfected and has priority over a conflicting security interest in the document so long as the debtor does not have possession of the document.</p><p>2000, c. <a href='http://lis.virginia.gov/cgi-bin/legp604.exe?001+ful+CHAP1007'>1007</a>.</p>
8.5A|UNIFORM COMMERCIAL CODE — LETTERS OF CREDIT|||||||||||§ 8.5A-118|Applicability.|<p>This title applies to a letter of credit that is issued on or after January 1, 1998. This title does not apply to a transaction, event, obligation, or duty arising out of or associated with a letter of credit that was issued before January 1, 1998. A transaction arising out of or associated with a letter of credit that was issued before January 1, 1998, and the rights, obligations, and interests flowing from that transaction are governed by Title 8.5 as it was effective on December 31, 1997, as if repeal or amendment had not occurred and may be terminated, completed, consummated, or enforced under that statute.</p><p>1997, c. <a href='http://lis.virginia.gov/cgi-bin/legp604.exe?971+ful+CHAP0343'>343</a>.</p>
